{
  "schema_version": "1.0.0",
  "context": {
    "workspace_id": "ws-demo",
    "session_id": "session-demo",
    "run_id": "run-demo",
    "document_id": "fs-demo",
    "base_document_version": "dv-7",
    "context_snapshot_id": "ctx-7",
    "template_id": "traditional-abap-five",
    "template_version": "1.0.0"
  },
  "event_id": "event-17",
  "sequence": 17,
  "occurred_at": "2026-10-03T08:00:00Z",
  "event_type": "run.waiting",
  "run_status": "waiting_evidence",
  "node_id": "N06",
  "data": {
    "message": "等待目标系统证据，可继续讨论稿",
    "progress": null,
    "entity_ids": [
      "verify-1"
    ],
    "error_code": null,
    "retryable": false,
    "result_version_id": null,
    "checkpoint_id": "cp-16"
  }
}
